{
  "_id": "2026-05-29-decoding-ever-expanding-cast",
  "tenantId": "toc",
  "sourceId": "2026-05-29-decoding-ever-expanding-cast-src",
  "title": "Decoding the Ever-Expanding Cast",
  "date": "2026-05-29",
  "org": "The Outreach Collective (TOC)",
  "status": {
    "transcribe": "done",
    "diarize": "pending",
    "summarize": "done",
    "index": "pending"
  }
}