{
  "_id": "2026-06-19-entrance-exams-pathways-india-part1",
  "tenantId": "toc",
  "sourceId": "2026-06-19-entrance-exams-pathways-india-part1-src",
  "title": "Entrance Exams & Pathways in India, Part 1",
  "date": "2026-06-19",
  "org": "The Outreach Collective (TOC)",
  "status": {
    "transcribe": "done",
    "diarize": "pending",
    "summarize": "done",
    "index": "pending"
  }
}