{
  "_id": "2026-08-03-uk-beyond-offer-letters-reupload",
  "tenantId": "toc",
  "sourceId": "2026-08-03-uk-beyond-offer-letters-reupload-src",
  "title": "UK: Beyond Offer Letters (re-uploaded copy)",
  "date": "2026-08-03",
  "org": "The Outreach Collective (TOC)",
  "status": {
    "transcribe": "done",
    "diarize": "pending",
    "summarize": "done",
    "index": "pending"
  }
}