{
  "_id": "2026-05-20-telling-your-brand-story-better",
  "tenantId": "toc",
  "sourceId": "2026-05-20-telling-your-brand-story-better-src",
  "title": "Telling Your Brand Story Better",
  "date": "2026-05-20",
  "org": "The Outreach Collective (TOC)",
  "status": {
    "transcribe": "done",
    "diarize": "pending",
    "summarize": "done",
    "index": "pending"
  }
}