{
  "_id": "2026-05-08-funding-dreams-loans-forex",
  "tenantId": "toc",
  "sourceId": "2026-05-08-funding-dreams-loans-forex-src",
  "title": "Funding Dreams: Loans, Scholarships & Financial Aid",
  "date": "2026-05-08",
  "org": "The Outreach Collective (TOC)",
  "status": {
    "transcribe": "done",
    "diarize": "pending",
    "summarize": "done",
    "index": "pending"
  }
}