{
  "_id": "2026-07-08-beyond-black-robes-law-careers",
  "tenantId": "toc",
  "sourceId": "2026-07-08-beyond-black-robes-law-careers-src",
  "title": "Beyond Black Robes: Rethinking Careers in Law",
  "date": "2026-07-08",
  "org": "The Outreach Collective (TOC)",
  "status": {
    "transcribe": "done",
    "diarize": "pending",
    "summarize": "done",
    "index": "pending"
  }
}