{
  "_id": "2026-08-27-in-focus-4",
  "tenantId": "toc",
  "sourceId": "2026-08-27-in-focus-4-src",
  "title": "In Focus #4",
  "date": "2026-08-27",
  "org": "The Outreach Collective (TOC)",
  "status": {
    "transcribe": "done",
    "diarize": "pending",
    "summarize": "done",
    "index": "pending"
  }
}