{
  "_id": "2026-08-24-uniaccess-leeds-arts-university",
  "tenantId": "toc",
  "sourceId": "2026-08-24-uniaccess-leeds-arts-university-src",
  "title": "UniAccess Live: Meet Leeds Arts University",
  "date": "2026-08-24",
  "org": "The Outreach Collective (TOC)",
  "status": {
    "transcribe": "done",
    "diarize": "pending",
    "summarize": "done",
    "index": "pending"
  }
}